<!ELEMENT apml (turnallocation?, performative+, turnallocation?)>

<!ATTLIST apml xml:lang CDATA "en">

<!ELEMENT turnallocation (performative)>
<!ATTLIST turnallocation type (take|give) #REQUIRED>

<!ELEMENT performative (theme|rheme)+>
<!ATTLIST performative 
type (implore|order|suggest|propose|warn|approve|praise|recognize|disagree|
agree|criticize|accept|advice|confirm|incite|refuse|question|ask|inform|request|
announce|beg|greet|paraphrase|none) #REQUIRED
		activation CDATA "1"
		>

<!ELEMENT theme (#PCDATA|emphasis|boundary|backchannel)*>
<!ATTLIST theme affect 
(anger|disgust|joy|distress|fear|sadness|surprise|embarrassment|happy-for|gloating|
resentment|relief|jealousy|envy|sorry-for|hope|satisfaction|fear-confirmed|disappointment|
pride|shame|reproach|liking|disliking|gratitude|gratification|remorse|love|hate|worried) #IMPLIED
                belief-relation
(gen-spec|cause-effect|solutionhood|suggestion|modifier|justification|contrast) #IMPLIED
                certainty 
(certain|uncertain|certainly_not|doubt) #IMPLIED
                meta-cognitive
(planning|thinking|remembering) #IMPLIED
		activation CDATA "1"
		intensity CDATA "1"
		> 

<!ELEMENT rheme (#PCDATA|emphasis|boundary|backchannel)*>
<!ATTLIST rheme affect (anger|disgust|joy|distress|fear|sadness|surprise|embarrassment|happy-for|gloating|
resentment|relief|jealousy|envy|sorry-for|hope|satisfaction|fear-confirmed|disappointment|
pride|shame|reproach|liking|disliking|gratitude|gratification|remorse|love|hate) #IMPLIED
                belief-relation
(gen-spec|cause-effect|solutionhood|suggestion|modifier|justification|contrast) #IMPLIED
                certainty 
(certain|uncertain|certainly_not) #IMPLIED
                meta-cognitive
(planning|thinking|remembering) #IMPLIED
		activation CDATA "1"
		intensity CDATA "1"
		> 

<!ELEMENT emphasis (#PCDATA)>
<!ATTLIST emphasis type (theme|rheme) #IMPLIED
                   level (strong|medium|weak) "medium"
                   x-pitchaccent (Hstar|Lstar|LplusHstar|LstarplusH|HstarplusL|HplusLstar) "Hstar"
                   deictic CDATA #IMPLIED
                   adjectival (small|subtle|tiny|difficult|big|long|large|great) #IMPLIED
				   activation CDATA "1"
		   >

<!ELEMENT boundary EMPTY>
<!ATTLIST boundary type (L|H|LL|HH|LH|HL) "LL">


<!ELEMENT backchannel EMPTY>
<!ATTLIST backchannel attitude (belief|disbelief|agreement|disagreement|acceptance|refuse|deny|confirm|
anger|disgust|joy|distress|fear|sadness|surprise|embarrassment|happy-for|gloating|resentment|relief|
jealousy|envy|sorry-for|hope|satisfaction|disappointment|pride|shame|reproach|liking|disliking|
gratitude|gratification|remorse|love|hate) #IMPLIED
                      >

<!ELEMENT pause EMPTY>
<!ATTLIST pause sec CDATA #REQUIRED>
