<?xml version="1.0" ?>
<!DOCTYPE apml SYSTEM "apml.dtd" []>
<apml xml:lang="en">
<performative type="announce">
<rheme affect="sadness">
When <emphasis x-pitchaccent="Hstar"> sorrows </emphasis> come <boundary type="LH"/> 
</rheme>
<rheme affect="sadness_and_anger">
they <emphasis x-pitchaccent="Hstar"> come not </emphasis> single spies 
 but in battalions <boundary type="LH"/>
</rheme>
</performative>
</apml>