<?xml version="1.0"?>
<!DOCTYPE apml SYSTEM "apml.dtd" []>
<apml>
<performative type="sorry-for">
buon <emphasis x-pitchaccent="Hstar">giorno</emphasis><boundary type="HL"/>
<rheme affect="joy" intensity="1.0">
mi chiamo 
<emphasis x-pitchaccent="Hstar">greta</emphasis><boundary type="LH"/>
e sono  un agente conversazionale<boundary type="HL"/>
</rheme>
</performative>
</apml>