<?xml version="1.0" ?>
<!DOCTYPE apml SYSTEM "apml.dtd" []>
<apml xml:lang="en">
<performative type="announce">
<rheme affect="tensed" intensity="0.2">
This is a <emphasis x-pitchaccent="Hstar"> slight </emphasis> expression of tension <boundary type="LH"/> 
</rheme>

<rheme affect="tensed" intensity="0.4">
This is a <emphasis x-pitchaccent="Hstar"> moderated </emphasis> expression of tension  <boundary type="LH"/> 
</rheme>

<rheme affect="tensed" intensity="1">
This is an expression of <emphasis x-pitchaccent="Hstar"> strong </emphasis> tension <boundary type="LH"/> 
</rheme>
</performative>
</apml>