<?xml version="1.0" ?>
<!DOCTYPE apml SYSTEM "apml.dtd" []>
<apml xml:lang="en">
<performative type="announce">
<rheme affect="disgust" intensity="0.2">
This is <emphasis x-pitchaccent="Hstar"> moderated </emphasis> expression of disgust <boundary type="LH"/> 
</rheme>
<rheme affect="disgust" intensity="1">
This is expression of <emphasis x-pitchaccent="Hstar"> a strong </emphasis> disgust <boundary type="LH"/> 
</rheme>
</performative>
</apml>