<?xml version="1.0"?>
<!DOCTYPE apml SYSTEM "apml.dtd" []>
<apml xml:lang="en">

<performative type="announce">
    <rheme>
        what are you<emphasis x-pitchaccent="Hstar" deictic="u" activation="0.4">doing</emphasis>here<boundary type="HH"/>
    </rheme>
</performative>

<performative type="warn">
    <theme>Did you
        <emphasis x-pitchaccent="Hstar" activation="0.8">pay</emphasis>
        attention to what I said or
        <emphasis x-pitchaccent="Hstar" deictic="self" activation="0.9">not</emphasis><boundary type="HH"/>
    </theme>
</performative>

<performative type="suggest">
    you should
    <rheme affect="resentment">take all of
    <emphasis x-pitchaccent="Hstar" adjectival="foreign_to_me" activation="0.9">your suff</emphasis>
    <boundary type="H"/>
    </rheme> 
</performative>

<performative type="order">
	<rheme>
    and
    <emphasis x-pitchaccent="Hstar" deictic="self2" activation="0.8">get</emphasis>
    out of 
    <emphasis x-pitchaccent="Hstar" deictic="self2" activation="0.8">this</emphasis>
    place immediately
    <boundary type="L"/>
    </rheme>
</performative>

<pause sec="2.0"/>

</apml>
